{
  "$schema": "http://json-schema.org/draft-07/schema#",
  "type": "object",
  "properties": {
    "events": {
      "type": "array",
      "items": {
        "type": "string",
        "minLength": 1
      }
    },
    "members": {
      "type": "array",
      "items": {
        "type": "string",
        "minLength": 1
      }
    },
    "news": {
      "type": "array",
      "items": {
        "type": "string",
        "minLength": 1
      }
    },
    "specialties": {
      "type": "array",
      "items": {
        "type": "string",
        "minLength": 1
      }
    },
    "Resources": {
      "type": "array",
      "items": {
        "type": "string",
        "minLength": 1
      }
    }
  },
  "required": [ "events", "members", "news", "specialties", "Resources" ]
}